{
  "type": "utterance.finalize",
  "protocol_version": 1,
  "event_id": "10ccfa30-c417-4403-9aae-91b4f80d2907",
  "source_id": "document-7",
  "client_seq": 185,
  "platform": "google_meet",
  "meeting_key": "fixture-meeting",
  "utterance_id": "caption-12",
  "revision": 3,
  "speaker": "Иван",
  "text": "Нам нужно перенести релиз на пятницу.",
  "observed_at": "2026-08-12T13:20:17.456Z"
}
